{"$schema":"https://json-schema.org/draft/2020-12/schema","type":"object","additionalProperties":false,"required":["document_id","analysis_id","document_type","title","sections","citations","validation_errors","warnings","generation_mode","can_export","updated_at"],"properties":{"document_id":{"type":"string"},"analysis_id":{"type":"string"},"document_type":{"type":"string"},"title":{"type":"string"},"sections":{"type":"array"},"citations":{"type":"array"},"validation_errors":{"type":"array"},"warnings":{"type":"array"},"generation_mode":{"type":"string"},"can_export":{"type":"boolean"},"updated_at":{"type":"string"}}}
