{"document_id":"doc_demo","analysis_id":"risk_demo","document_type":"trademark_registration_risk_report","title":"MarkLens商标注册风险评估报告","sections":[{"section_id":"usage","title":"使用说明","content":"不构成法律意见。","citation_ids":[]}],"citations":[],"validation_errors":[],"warnings":["演示数据"],"generation_mode":"template_fallback","can_export":true,"updated_at":"2026-07-13T12:00:03"}
